{
  "version": 1,
  "device_id": "device-alpha",
  "algorithm": "sha256",
  "credentials": [
    {
      "id": "current",
      "digest": "aaaaaaaaaaaaaaaaaaaaaaaaaaaaaaaaaaaaaaaaaaaaaaaaaaaaaaaaaaaaaaaa",
      "not_before": "2026-01-01T00:00:00Z",
      "not_after": "2099-01-01T00:00:00Z"
    },
    {
      "id": "next",
      "digest": "bbbbbbbbbbbbbbbbbbbbbbbbbbbbbbbbbbbbbbbbbbbbbbbbbbbbbbbbbbbbbbbb",
      "not_before": "2026-07-01T00:00:00Z",
      "not_after": "2099-07-01T00:00:00Z"
    }
  ]
}
