{
  "version": 1,
  "device_id": "compute-01",
  "algorithm": "sha256",
  "credentials": [
    {
      "id": "current",
      "digest": "1111111111111111111111111111111111111111111111111111111111111111",
      "not_before": "2026-01-01T00:00:00Z",
      "not_after": "2099-01-01T00:00:00Z"
    }
  ]
}
